title,link,description,bloggername,bloggerlink,postdate
함소아몰 함소아<b>오메가3</b>+유산균 등등등등 개봉,https://blog.naver.com/kww1517/224183227872,26.2.12주문 새벽에 갑자기 눈을ㅋ떴고 얼마전에 다먹은 <b>오메가3</b> 생각이 났고 이것저것 비교하다가... 기존먹던 <b>오메가3</b>보다 그렇다고한다 안에 내용물은.훨 맛있단다 z 이것은 슈팅스타처럼 파파파파팍... ,여기아냐 공부하러가,blog.naver.com/kww1517,20260213
테일스마일 스마일츄  강아지덴탈껌,https://blog.naver.com/jinni7942/224183227860,점프 스마일츄 테일스마일 스마일츄 브라이트 (SMILE CHEW BRIGHT) 스마일츄 브라이트는 블루베리.<b>오메가</b>-<b>3</b> 마리골드 추출물이 함유가 되어 눈 건강.시력 보호에 도움을 주는 덴탈껌이랍니다. 예전에 눈물이 팡팡... ,코코맘의 따뜻한 일상,blog.naver.com/jinni7942,20260213
투명감 있는 피부를 위한 건강한 생활습관 알아보기,https://blog.naver.com/fbrd6u5rtj/224183227351,"과일과 채소, <b>오메가</b>-<b>3</b> 지방산이 풍부한 음식을 섭취하면 피부에 필요한 영양소를 공급할 수 있습니다. 예를 들어, 아보카도, 연어, 블루베리 등이 좋은 선택입니다. 개인적으로 매일 아침 스무디를 만들어... ",포도요법,blog.naver.com/fbrd6u5rtj,20260213
청초미 피부톤 효과적인 관리의 핵심은 무엇인가,https://blog.naver.com/open373/224183227409,"청초미 피부톤을 유지하기 위해서는 비타민 C, E, <b>오메가</b>-<b>3</b> 지방산 등이 풍부한 음식을 섭취하는 것이 좋습니다. 비타민 C는 피부의 콜라겐 생성을 촉진하고, 비타민 E는 항산화 작용을 통해 피부를 보호합니다.... ",open373님의블로그,blog.naver.com/open373,20260213
"[005] 이러면 안돼,,,",https://blog.naver.com/goodluckriin/224183225991,"공복 몸무게: 62.75 ✨아침: 사과땅콩버터올리브유 ✨ 점심: 양배추어묵볶이(+빈스마켓) ✨ 저녁: 초밥, 마라상궈 ✨ 야식: 피자  비타민D, 철분, <b>오메가3</b>, 맥주효모",-,blog.naver.com/goodluckriin,20260213
연톤 피부를 위한 채소 선택과 효과적인 관리법,https://blog.naver.com/tempt_896573/224183226419,"특히, <b>오메가</b>-<b>3</b> 지방산이 풍부한 생선이나 아몬드와 같은 견과류는 피부 건강에 큰 도움이 됩니다. 또한, 수분 섭취를 늘리기 위해 물을 충분히 마시는 것이 중요합니다. 이 외에도 과일, 특히 베리류는 항산화... ",tempt_896573님의블로그,blog.naver.com/tempt_896573,20260213
손이 많이 간 피부 생활습관 변화로 관리하는 방법,https://blog.naver.com/strip1252888/224183226099,"특히 비타민 C, E, 그리고 <b>오메가</b>-<b>3</b> 지방산이 풍부한 음식을 섭취하는 것이 좋습니다. 저는 매일 다양한 색상의 과일과 채소를 포함한 샐러드를 즐기며, 이러한 변화가 피부의 화사함과 생기를 더해 주었습니다.... ",strip1252888님의블로그,blog.naver.com/strip1252888,20260213
"민족 대명절 설날, 이웃에게 드리는 새해 인사!",https://blog.naver.com/joosiksin/224183226015,"① 새해의 의미 설날은 단순히 한 해의 시작을 알리는 날이 아니라, 지난 시간을 돌아보고 앞으로의 길을 다짐하는 날입니다. 조상과 가족을 기리는 전통 속에서, 우리는 서로에게 따뜻한 마음을 나누며... ",~Value Up~,blog.naver.com/joosiksin,20260213
아카나 와일드 프레이리 캣 고양이사료로 더 건강하게 자란... ,https://blog.naver.com/twapfs/224183225318,아카나 와일드 프레이리 캣에는 <b>오메가3</b>와 오메가6 지방산이 포함되어 있습니다. 이 지방산은 피부와 털 건강에 중요한 역할을 합니다. 건강한 피부와 윤기 있는 털은 고양이의 전반적인 건강을 나타내는 중요한... ,고래감별사,blog.naver.com/twapfs,20260213
생활습관으로 빛이 고른 피부 실천법과 대처법,https://blog.naver.com/forward142277/224183225239,"또한, <b>오메가</b>-<b>3</b> 지방산이 풍부한 생선이나 견과류는 피부의 수분을 유지하는 데 중요한 역할을 합니다. 가공식품이나 설탕의 과다 섭취는 피부에 염증을 유발할 수 있으므로 주의가 필요합니다. 따라서 균형 잡힌... ",forward142277님의블로그,blog.naver.com/forward142277,20260213
